{"blockers":[{"code":"seed-0-blocked","description":"No live cluster version, site policy, scheduler client, accounting configuration, or native execution was validated."},{"code":"seed-1-blocked","description":"Slurm documentation snapshot identity, the OpenPBS ngpus rendering assumption, repository snapshot identity, and central processor attestation remain unresolved."}],"contract_name":"skill-document-scope-inventory","enumeration":{"extractor":{"attestation_id":null,"configuration_ref":{"path":"contracts/official-document-pack-seed.schema.json","sha256":"82d86a53e420836161b1fe901736d83315c7e265c42f7771e5d8bd8ce9785599"},"dependency_lock_ref":{"path":"contracts/official-document-pack-builder-lock.json","sha256":"3f8c0a577b8f1edb7bc4fe52849cfccc0b5dbc2c4350ea47521fa42fc36d48ff"},"implementation_ref":{"path":"tools/build_official_document_packs.py","sha256":"e8cc4b4e3bf6ee7ceb736e563306ee769999d36f134cdb7a396ef7214274972f"},"input_sha256":"abee35f869279998f4d0f853d66cb2a2d17e97f2661ddb0eccbb6842291f898b","output_sha256":"ef18414d436746239a648254769b62939afc376c2f295dbf36234279c140a4d1","tool_id":"official-document-pack-scope-extractor","tool_version":"1.0","trust_mode":"central-pinned"},"method":"deterministic-extractor","reviewed_by":"official-document-pack-builder","reviewed_utc":"2026-07-24T00:00:00Z","scope_complete":false},"inventory_id":"dft-hpc-execution-official-document-scope","limitations":["OpenPBS v23.06.06 sources cover a synthetic candidate surface only; they do not activate an OpenPBS operational route.","Semantic claim-set completeness remains explicitly unproven; exact full-file enumeration is not treated as claim closure.","Slurm receipts identify rolling 26.05 pages at retrieval, not an installed cluster version or site policy.","The deterministic scope extractor is centrally pinned but this exact run is not platform attested.","The pack is metadata-only: scheduler manuals, specifications, and repository contract bodies remain external."],"producer":{"generated_utc":"2026-07-24T00:00:00Z","skill_id":"dft-hpc-execution","skill_version":"1.0","tool_id":"official-document-pack-builder","tool_version":"1.0"},"schema_version":"1.0","skill_id":"dft-hpc-execution","skill_registry_binding":{"lifecycle":"development","registry_path":"registry/skill-registry.yaml","registry_sha256":"ba3e9318b4c9d9e311841377dd1ebd8efa7cd27d6309b57376f9fb6f248694b9","skill_path":"skills/dft-hpc-execution","source_tree_hash_domain":"VIBE-DFT-SKILL-SOURCE-TREE-v2","source_tree_sha256":"abee35f869279998f4d0f853d66cb2a2d17e97f2661ddb0eccbb6842291f898b"},"skill_source_refs":[{"path":"skills/dft-hpc-execution/SKILL.md","sha256":"c17f71efba9e00359447bc91acdd864c642421aad1c4d3b50accf3cddb8b9ac8"},{"path":"skills/dft-hpc-execution/agents/openai.yaml","sha256":"dd1a7270f4879aa8324b877237a3db272ea931a5f67dcad93bfec31fd1555956"},{"path":"skills/dft-hpc-execution/examples/expected-render-report.json","sha256":"1da1ee8286a9912732537e488c8bdcb85089cc311afbc288b7e4145a801a8e3d"},{"path":"skills/dft-hpc-execution/examples/render-dry-run-command.txt","sha256":"e64fb34999d4382c1ce5d9b168468d99edba0d44a0d4f7d5e367b23ddf6b6e77"},{"path":"skills/dft-hpc-execution/fixtures/scheduler-success-app-failure.json","sha256":"42b59b47ceffecbe1bff403615afb8f02177252af56cdfe2cf737ba7f26eed65"},{"path":"skills/dft-hpc-execution/fixtures/slurm-decision.json","sha256":"c234776a4dfa92eac9522b49c5fdb7b61e4668ab70b86d3795240e84f676ea3a"},{"path":"skills/dft-hpc-execution/fixtures/slurm-lease.json","sha256":"f79024e231cb85ce0eb23f99f538d931e159570a43ba9b2d4dbc504517d6fade"},{"path":"skills/dft-hpc-execution/fixtures/slurm-request.json","sha256":"2f3b097946996c5483dec801b00a11d115fae62979a0ebfd2633d637ead18034"},{"path":"skills/dft-hpc-execution/references/decision-table.md","sha256":"c18a67ae228225d089c801a8eb92e0018260244326bd686fd195b98dcbe18e96"},{"path":"skills/dft-hpc-execution/references/environment-and-authorization.md","sha256":"c9b14c8c09409224fdff0026bdfea8cf72e0193c28c935229d1f725995896f03"},{"path":"skills/dft-hpc-execution/references/fail-closed-contract.md","sha256":"4e3850ff3c84bcd39f3b058584186f57588a9dca71c571e6188a7e50e9966509"},{"path":"skills/dft-hpc-execution/references/finding-catalog.json","sha256":"341a856310877a605a231371923895dcec17ca1f58816df1999e9ded2e968028"},{"path":"skills/dft-hpc-execution/references/fixture-manifest.json","sha256":"3755cab348b9e8c9aef102396516a4d8a1050578636f89219b8cd91572f24e8b"},{"path":"skills/dft-hpc-execution/references/maturity-matrix.json","sha256":"4cb756f56373fba323cb2122bfc95a2d19e60c836f0d5dedc76b5c24668090d7"},{"path":"skills/dft-hpc-execution/references/official-source-index.json","sha256":"62b408c8fdcaefe160eb630a497dbd8862c54aca24d4dde14fc23c7c151cea58"},{"path":"skills/dft-hpc-execution/references/operational-playbooks.md","sha256":"c9144b143c5bf4b613a4e3ed136987d47d605f3ae5fe1f8dc9406a9db11f7d45"},{"path":"skills/dft-hpc-execution/references/repository-interface-manual.md","sha256":"086fed340786f5f973411d0c1c38a6c46961b9149a9b91c54b12a6d36003c022"},{"path":"skills/dft-hpc-execution/references/scheduler-status-mapping.json","sha256":"d332ad92d95102b07e29bda2a7239008c3ad0b3cc568195aad985d9ed6b7452f"},{"path":"skills/dft-hpc-execution/references/slurm-operations.md","sha256":"0b02d3990215feab29eaf7e89352534f49cabc29956d1aaf6822883722575a18"},{"path":"skills/dft-hpc-execution/references/source-catalog-json-schema-2020-12.json","sha256":"2379a3dfb774b97dfeb1ac0ebca72fbec8d9e9b45692d7a7976af9eceac80873"},{"path":"skills/dft-hpc-execution/references/source-catalog-openpbs-23-06-06.json","sha256":"51784a8cea87b402fbcf87a4a19ab54110a8ce3a3a6950fe9a6c300659d60ecf"},{"path":"skills/dft-hpc-execution/references/source-catalog-repository-interfaces.json","sha256":"79d0a91f69d3641314c55fe10a64f3df5e4ae2c1c940cccdc43f1652576509f3"},{"path":"skills/dft-hpc-execution/references/source-catalog-slurm-26-05-live.json","sha256":"1db5e7879c4807bcfefb18cdcaa9acf8422155f26a4614860d55b0aa36d87b6e"},{"path":"skills/dft-hpc-execution/references/source-pack-authority-proposal.json","sha256":"1fb31e592e6a3cda489bf13575d8a83de0804ddaf0678611fef4d17893846730"},{"path":"skills/dft-hpc-execution/references/source-pack-inputs.json","sha256":"1076d34d4dbe4ce383c36117fe54b318de96224954e90741606e99c0e8b223de"},{"path":"skills/dft-hpc-execution/references/source-pack-scope-catalog.json","sha256":"d73a125d15164582fcbb2c7be4f1fc1140affe6f2aa732aae0ed7ef14e309c94"},{"path":"skills/dft-hpc-execution/references/source-pack-seed.json","sha256":"7e38cce3a36c84b7ccf5e8c7f6b37ea55b550e00b6c5f2d73e73d537a12fa2ff"},{"path":"skills/dft-hpc-execution/references/task-evidence-profiles.json","sha256":"82b865b7b1db1166a0e3b51ecbe0ef7ba28138c367aed859ccded9a8123c6733"},{"path":"skills/dft-hpc-execution/references/task-matrix.json","sha256":"962b396b0b8eb966c584959d232ff4626182800ab973f3e4b20b84146f6698ab"},{"path":"skills/dft-hpc-execution/references/weak-model-decision-table.json","sha256":"6c5583da3dc49c5369cf3fb71259bc6cfb64100f804cf533191575dcb6f11f8b"},{"path":"skills/dft-hpc-execution/scripts/extract_official_source_scope.py","sha256":"cd49787745bb92df2dbcf5663911ddff18781196e492f0654e545c9b1dadb55b"},{"path":"skills/dft-hpc-execution/scripts/hpc_execution_cli.py","sha256":"7792ab93431fefa236f8656490c3cf81dac43d4f33bc8782825e04fc531c180e"},{"path":"skills/dft-hpc-execution/tests/test_hpc_execution_cli.py","sha256":"428b68b3ad41b04267d86a3b501100bd1a5bf618139a32373564578f0c29db40"}],"status":"blocked","subjects":[{"evidence_class":"deterministic-tool-behavior","origin_refs":[{"path":"skills/dft-hpc-execution/scripts/hpc_execution_cli.py","selector":{"kind":"whole-file","value":"*"},"sha256":"7792ab93431fefa236f8656490c3cf81dac43d4f33bc8782825e04fc531c180e"},{"path":"skills/dft-hpc-execution/SKILL.md","selector":{"kind":"whole-file","value":"*"},"sha256":"c17f71efba9e00359447bc91acdd864c642421aad1c4d3b50accf3cddb8b9ac8"}],"statement":"The candidate validates local JSON, renders stdout intent, and classifies supplied observations without network, SSH, scheduler, process, file-staging, or scientific-executable side effects.","subject_id":"hpc.boundary.no-external-side-effect","subject_kind":"limitation"},{"evidence_class":"repository-policy","origin_refs":[{"path":"skills/dft-hpc-execution/references/slurm-operations.md","selector":{"kind":"whole-file","value":"*"},"sha256":"0b02d3990215feab29eaf7e89352534f49cabc29956d1aaf6822883722575a18"},{"path":"skills/dft-hpc-execution/references/repository-interface-manual.md","selector":{"kind":"whole-file","value":"*"},"sha256":"086fed340786f5f973411d0c1c38a6c46961b9149a9b91c54b12a6d36003c022"}],"statement":"Cancellation is a separate external side effect requiring fresh human confirmation and post-cancel observation.","subject_id":"hpc.cancel.separate-authorization","subject_kind":"limitation"},{"evidence_class":"deterministic-tool-behavior","origin_refs":[{"path":"skills/dft-hpc-execution/scripts/hpc_execution_cli.py","selector":{"kind":"whole-file","value":"*"},"sha256":"7792ab93431fefa236f8656490c3cf81dac43d4f33bc8782825e04fc531c180e"},{"path":"skills/dft-hpc-execution/references/fail-closed-contract.md","selector":{"kind":"whole-file","value":"*"},"sha256":"4e3850ff3c84bcd39f3b058584186f57588a9dca71c571e6188a7e50e9966509"}],"statement":"Request, decision, and lease use strict bounded JSON, exact raw-byte bindings, non-broadening grants, and local single-use checks.","subject_id":"hpc.identity.request-decision-lease","subject_kind":"workflow"},{"evidence_class":"deterministic-tool-behavior","origin_refs":[{"path":"skills/dft-hpc-execution/scripts/hpc_execution_cli.py","selector":{"kind":"whole-file","value":"*"},"sha256":"7792ab93431fefa236f8656490c3cf81dac43d4f33bc8782825e04fc531c180e"},{"path":"skills/dft-hpc-execution/references/repository-interface-manual.md","selector":{"kind":"whole-file","value":"*"},"sha256":"086fed340786f5f973411d0c1c38a6c46961b9149a9b91c54b12a6d36003c022"}],"statement":"